LIBRARY MANAGEMENT DATABASE IN POSTGRES BY AJAY AGRAWAL

DATABASE NAME - LIBRARY

TABLES - 

FEES // IT HAS  ALL FEES DETAILS OF READERS .

READERS //IT HAS ALL INFORMATION ABOUT THE READERS

BOOKS // IT HAS ALL INFORMATION ABOUT THE BOOKS

BORROW // IT HAS ISBN NO. OF BOOK AND ID OF READER

BOOKS_STATUS // IT HAS B_ID , ISBN AND STATUS OF BOOKS


TABLES -

               FEES
 
 id  | fees_slot | fees |   status   
-----+-----------+------+------------
 101 | M         |  250 | SUBMIT
 102 | Y         | 2000 | NOT SUBMIT
 103 | M         |  250 | NOT SUBMIT
 104 | Q         |  550 | SUBMIT
 105 | M         |  250 | SUBMIT
 106 | H         | 1100 | NOT SUBMIT
 107 | Y         | 2000 | SUBMIT
 108 | M         |  250 | SUBMIT
 109 | H         | 1100 | NOT SUBMIT
 110 | Y         | 2000 | SUBMIT
(10 rows)


                        READERS
 
 id  |  name   |  city   |   mobile   | profession |    dob     
-----+---------+---------+------------+------------+------------
 101 | RITIK   | DELHI   | 9998798589 | STUDENT    | 2000-09-18
 102 | RAHUL   | MUMBAI  | 6958798589 | STUDENT    | 2001-01-13
 103 | DANYA   | AGRA    | 8545488589 | BUSINESS   | 2000-04-15
 104 | GARGI   | DELHI   | 8752359858 | DOCTOR     | 2001-12-17
 105 | RAMESH  | DELHI   | 8956987895 | ENGINEER   | 1997-12-05
 106 | LAKSHYA | LUCKNOW | 6989785825 | MARKETING  | 1999-05-14
 107 | JATIN   | LUCKNOW | 9895989869 | ENGINEER   | 2000-08-19
 108 | DANYA   | DELHI   | 9895989869 | STUDENT    | 2001-05-18
 109 | DEEPAK  | RAIPUR  | 6989782565 | DOCTOR     | 1995-07-16
 110 | GARIMA  | JAIPUR  | 5898529836 | ACTOR      | 1998-11-09
(10 rows)


                                          BOOKS
 
 isbn |          name           |       author        |      publication      | price 
------+-------------------------+---------------------+-----------------------+-------
 1001 | ONE STEP TOWARD SUCCESS | DR. RAMANUJAN       | JUNOON PUBLICATIONS   |   258
 1002 | TARKASH                 | JAVED AKHTAR        | PEACE PUBLICAIONS     |   193
 1003 | MY STORY                | DARSHAD SHARMA      | NISHANT PUBLICATIONS  |   780
 1004 | HOW TO COOK ?           | REEMA CHATURVEDI    | NISHANT PUBLICATIONS  |   870
 1005 | HORROR IS MY PASSION    | NAGRAJ DESHMUKH     | DRISHYAM PUBLICAITONS |   360
 1006 | GOONJ                   | SHAKEEL AZMI        | PEACE PUBLICAIONS     |   450
 1007 | OOPS IN JAVA            | DR. HARRY SMITH     | GRACY PUBLICATIONS    |   850
 1008 | DIGITAL MARKETING       | DR. TIM STARC       | GRACY PUBLICATIONS    |   640
 1009 | HOW TO MARKET ?         | DR. GLARRY PETERSON | GRACY PUBLICATIONS    |   280
 1010 | PANCHTANTRA             | VISHNU SHARMA       | BHAGWAD PUBLICATIONS  |   900
(10 rows)


  BORROW
 
 isbn | id  
------+-----
 1010 | 104
 1008 | 105
 1007 | 105
(3 rows)


    BOOKS_STATUS

b_id | isbn | status 
------+------+--------
    1 | 1001 |      1
    2 | 1001 |      1
    3 | 1001 |      1
    4 | 1001 |      1
    5 | 1001 |      1
    6 | 1002 |      1
    7 | 1002 |      1
    8 | 1002 |      1
    9 | 1002 |      1
   10 | 1002 |      1
   11 | 1002 |      1
   12 | 1002 |      1
   13 | 1002 |      1
   14 | 1002 |      1
   15 | 1002 |      1
   16 | 1002 |      1
   17 | 1002 |      1
   18 | 1002 |      1
   19 | 1003 |      1
   20 | 1003 |      1
   21 | 1003 |      1
   22 | 1003 |      1
   23 | 1003 |      1
   24 | 1003 |      1
   25 | 1003 |      1
   26 | 1003 |      1
   27 | 1003 |      1
   28 | 1003 |      1
   30 | 1004 |      1
   31 | 1004 |      1
   32 | 1004 |      1
   33 | 1005 |      1
   34 | 1005 |      1
   35 | 1005 |      1
   36 | 1005 |      1
   37 | 1006 |      1
   38 | 1006 |      1
   39 | 1006 |      1
   40 | 1006 |      1
   41 | 1006 |      1
   42 | 1006 |      1
   43 | 1006 |      1
   44 | 1007 |      1
   45 | 1007 |      1
   46 | 1007 |      1
   47 | 1007 |      1
   48 | 1007 |      1
   49 | 1008 |      1
   50 | 1008 |      1
   51 | 1009 |      1
   52 | 1009 |      1
   53 | 1009 |      1
   54 | 1010 |      1
   55 | 1010 |      1
   56 | 1010 |      1
   57 | 1010 |      1
   58 | 1010 |      1
   59 | 1010 |      1
   60 | 1010 |      1
   61 | 1010 |      1
   62 | 1010 |      1
   63 | 1010 |      1
   64 | 1010 |      1
   65 | 1010 |      1
   66 | 1010 |      1
(65 rows)

(END)





Some operations : 

ALTER TABLE BOOKS DROP CONSTRAINT BOOKS_PKEY; // delete isbn as primary key from books

alter table books add column b_id int; // Add Column b_id to table books

update books set b_id=01  where isbn=1001; // insert values in b_id of books

alter table books add primary key(b_id); // set b_id as primary key in books

ALTER TABLE BORROW DROP CONSTRAINT BORROW_PKEY; // delete isbn as primary key from borrow

alter table borrow add column b_id int; // Add Column b_id to table borrow

update borrow set b_id=10  where isbn=1010; // insert values in b_id of books

alter table borrow add primary key(b_id); // set b_id as primary key in borrow

ALTER TABLE BORROW ADD CONSTRAINT fk_borrow_id FOREIGN KEY (id) REFERENCES readers(id); // set id of readers as foreign key for id of borrow 

ALTER TABLE borrow ADD CONSTRAINT fk_borrow_bid FOREIGN KEY(b_id) REFERENCES books_status(b_id); // set b_id of books_status as foreign key
for b_id of borrow 


QUERIES : 


1. TAKE NAME OF BOOKS WITH BORROWER NAME 

QUERY : 

SELECT R.NAME READER_NAME,BR.ISBN,B.NAME BOOK_NAME FROM BORROW BR RIGHT JOIN READERS R ON R.ID=BR.ID RIGHT JOIN BOOKS B ON B.ISBN=BR.ISBN;
 
OUTPUT :

reader_name | isbn |        book_name        
-------------+------+-------------------------
 GARGI       | 1010 | PANCHTANTRA
 RAMESH      | 1008 | DIGITAL MARKETING
 RAMESH      | 1007 | OOPS IN JAVA
             |      | HOW TO MARKET ?
             |      | MY STORY
             |      | ONE STEP TOWARD SUCCESS
             |      | GOONJ
             |      | HORROR IS MY PASSION
             |      | TARKASH
             |      | HOW TO COOK ?
(10 rows)

2. FIND AGE OF READERS WITH NAME

QUERY :

select name,extract(year from age(dob)) as age from readers;

OUTPUT :

name   | age 
---------+-----
 RITIK   |  21
 RAHUL   |  20
 DANYA   |  21
 GARGI   |  20
 RAMESH  |  24
 LAKSHYA |  22
 JATIN   |  21
 DANYA   |  20
 DEEPAK  |  26
 GARIMA  |  23
(10 rows)

3. FIND AVAILABLE BOOKS

QUERY :

Select (select count(b_id) from books)-(select count(isbn) from borrow) as available_books;

OUTPUT :

available_books 
-----------------
               7
(1 row)

4. DISPLAY NAME AND FEES STATUS OF READERS WHICH SLOT IS MONTHLY 

QUERY :

select name,status from readers r right join fees f on r.id=f.id where f.fees_slot='M';


OUTPUT :

name  |   status   
--------+------------
 RITIK  | SUBMIT
 DANYA  | NOT SUBMIT
 RAMESH | SUBMIT
 DANYA  | SUBMIT
(4 rows)


5. UPDATE FEES OF READERS WHICH SLOT IS MONTHLY

QUERY :

UPDATE FEES SET FEES=300 WHERE FEES_SLOT='M';

OUTPUT :

id  | fees_slot | fees |   status   
-----+-----------+------+------------
 101 | M         |  300 | SUBMIT
 102 | Y         | 2000 | NOT SUBMIT
 103 | M         |  300 | NOT SUBMIT
 104 | Q         |  550 | SUBMIT
 105 | M         |  300 | SUBMIT
 106 | H         | 1100 | NOT SUBMIT
 107 | Y         | 2000 | SUBMIT
 108 | M         |  300 | SUBMIT
 109 | H         | 1100 | NOT SUBMIT
 110 | Y         | 2000 | SUBMIT
(10 rows)

6. DISPLAY THE NAME OF BOOK WITH AVAILABLE COPIES

QUERY :

select b.name,count(b_id) from books b right join books_status br on b.isbn=br.isbn where b.isbn=1001 and status=1 group by b.isbn;

OUTPUT :

  name           | count 
-------------------------+-------
 ONE STEP TOWARD SUCCESS |     5

(1 row)



